Id,title,company,location,description,search_city,link
148,Data Analytics Product Architect,Gap Inc. Corporate,"San Francisco, CA","Our past is full of iconic moments — but our future is going to spark many more. We're looking for the people who'll help make our next decade just as revolutionary as our first five. If you're one of the super-talented who thrive on change, aren't afraid to take risks and love tomake a difference, you're the right fit. Come grow with us.
Gap Tech drives innovative retail, e-commerce and global enterprise technology for our headquarters operations and our five iconic brands across the world. We push boundaries. We challenge the status quo. Innovation sits at the core of everything we do. And we’re not here just to execute; we’re here to learn and grow. As individuals, we’re passionate, diverse, innovative and wickedly talented. As a team, we’re making amazing things happen in our offices, our stores and our communities. We are diversifying our talent globally, and expanding our reach by opening a technology hub in Hyderabad, India. Growing over time, this center will become critical in enabling technology that powers Gap Inc. business globally.

Summary: Gap Inc. is looking for a highly motivated Architect with a focused background in designing Big Data, BI applications in a hybrid on-prem, cloud platforms. You will have the opportunity to be part of a creative team responsible for building a customer-centric data-platform supporting our Omni-channel business, seamless inventory management and PRODUCT 3.0 company initiatives. As a Solutioning expert, you will architect, design, and build enterprise class Business Intelligence Solutions. Your success will be measured on your ability to rapidly develop a keen understanding of Gap’s Information architecture while working closely with other architecture and development teams to build world-class solutions

Key Responsibilities:
Work with business teams and technical analysts to understand business requirements. Determine how to leverage technology to create solutions that satisfy the business requirements.
Present solutions to the business, project teams, and other stakeholders with the ability to speak technical and non-technical
Create architecture and technical design documents to communicate solutions that will be implemented by the development team.
Work with development, infrastructure, test, and production support teams to ensure proper implementation of solution.
Mentor team members on best practices in area of expertise.
Identify and suggest training opportunities for immediate workgroup to help promote bench strength
Develop proofs-of-concept and prototypes to help illustrate approaches to technology and business problems.
Key Requirements

Data integration (Continuous and discretized data streaming) across On-prem, cloud, Hadoop, RDBMSs, NoSQL (Cosmos, MongoDB, Hbase) and Datawarehousing systems;

Building real-time data pipelines using Kafka, Spark, Storm, Flume, Event-hub, Stream Analytics (Azure) or similar stacks on other leading cloud platforms

Extensive experience using Python, R, Scala, Pig, Hive

Building consumption frameworks on Hadoop, Azure or GCP (Restful services, Self-service BI and Analytics)

Exposure in Hadoop security, Data management and Governance

Experience in Test Driven Development using Frameworks

Experience in one or more analytical modeling tools/workbench (Jupyter or Zeppelin). Experience in SAS is a plus

Ability to understand business requirements and building pragmatic/cost effective solutions using Agile project methodologies

Excellent problem solving and analytical skills

Executive Speaking and Presentation Skills – White board, small and large group presentations

Ability to work effectively across internal and external organizations

REQUIRED EXPERIENCE AND EDUCATION:

Overall 4-8 years enterprise IT application experience (minimum of 2 years in big data / cloud architecture)

Experience building applications on one of the leading cloud providers – Azure, AWS or GCP

Bachelor’s degree in Computer Science, Math or related field. Masters in a related field would be a plus.

KEY BENEFITS:

Merchandise discount for our brands: 50% off regular-priced merchandise at Gap, Banana Republic and Old Navy, 30% off at Outlet and 25% off at Athleta.
One of the most competitive Paid Time Off plans in the industry.*
Employees can take up to five “on the clock” hours each month to volunteer at a charity of their choice.*
Extensive 401(k) plan with company matching for contributions up to four percent of an employee’s base pay.*
Employee stock purchase plan.*
Employees receive medical, dental, vision and life insurance.*
Employees can apply for tuition reimbursement.*
Family care programs.
Commuter benefits.
Pet Discount Program.
For eligible employees
Gap Inc. is an equal-opportunity employer and is committed to providing a workplace free from harassment and discrimination. We are committed to recruiting, hiring, training and promoting qualified people of all backgrounds, and make all employment decisions without regard to any protected status. In 2016, Gap Inc. was named one of the Best Places to Work by the Human Rights Campaign for the thirteenth consecutive year and was the sole winner of the Catalyst award for equality in the workplace in 2016.",San Francisco,http://www.indeed.com//rc/clk?jk=503d6e378ce7fef2&fccid=76644a33987f2488&vjs=3
149,Product Management Analyst,Jam City,"San Francisco, CA","We are always looking for the “best and brightest” talent to join our family. At Jam City you will have the freedom to work and play with a team of entrepreneurs who aren’t afraid to get things done!

Perks & Benefits
Unlimited Paid Time Off, Paid Sick Days & Holidays
100% Employee Covered Medical, Dental, Vision Plan Base Plan
Life Insurance, 401k, Flexible Spending Accounts, Commuter Benefits & More
Catered Lunches & Well-stocked Kitchens
Yoga & Wellness Activities
Happy Hours
Company Retreats

Responsibilities:
Support the Product Manager in owning the development and management of games
Analyzes data, builds automated reports, and works with Analytics team to get all necessary data at the right time to manage game metrics
Assists in managing in game economy, sales, CRM programs, seasonal content, and user acquisition
Evaluating industry, competitor, market, and technology trends as inputs into the roadmap
Comfortable extracting data using SQL and analyzing in Tableau and Excel
Tracking performance of features via a/b test experimentation to identify areas of improvement
Understands game metrics to inform hypotheses, and creates experiments with clear and measurable success goals
Requirements:
Strong quantitative and analytical skills; the ability to derive conclusions from data and clearly communicate findings is critical
Create, manage and distribute data and insights via regular and ad-hoc reporting utilizing reporting/analysis platforms (i.e. Tableau, SQL, Excel)
Bachelors degree in Computer Science, Business or related fields",San Francisco,http://www.indeed.com//rc/clk?jk=4602fe190023a3e5&fccid=92938f0e989918d3&vjs=3
150,Data Science Intern,Square,"San Francisco, CA 94103","Job Description

You will:
Partner with Square’s product teams to prioritize and answer the most important questions where analytics will have material impact
Work on Square’s Central Data team with Data Scientists and Product Analysts
Use your experience in analytics tools and scientific rigor to produce actionable insights
Collaborate with business leaders, subject matter experts, and decision makers to develop success criteria and optimize new products, features, policies, and models
Build visualizations that expose the health and performance of our products
Communicate key results to senior management in verbal, visual, and written media Qualifications


You have:
Pursuing a degree in Economics, Statistics, Computer Science, Mathematics, or related technical field
Hands on experience in executing data analysis, plus for experience using SQL, Hive, R, and/or Python
Ability to understand complex business and data systems
Ability to clearly communicate complex results to technical and non-technical audiences
Versatility and willingness to learn new technologies on the job
Even better:
Programming experience in one or more object-oriented languages, including: Python, C, C++, Java, Ruby, Scala, and Go.
An advanced degree (M.S., PhD.), preferably in Statistics, Computer Science, Physical Sciences, Economics, or a related technical field
Familiarity with Linux/OS X command line, version control software (git), and general software development
Experience in programming or scripting to enable ETL development
Familiarity with Machine Learning ( e.g. regression, ensemble methods, etc.)
Familiarity with relational databases such as Postgres, Vertica
Previous industry experience or internships in product related analytics
Independent research experience
Technologies we use and teach:
Python ( numpy, pandas, sklearn)
Vertica, Hive
Statistics (Bayesian methods, experimental design, causal inference)
Tableau
Additional Information

At Square, we value diversity and always treat all employees and job applicants based on merit, qualifications, competence, and talent. We do not discriminate on the basis of race, religion, color, national origin, gender, sexual orientation, age, marital status, veteran status, or disability status. We will consider for employment qualified applicants with criminal histories in a manner consistent with the requirements of the San Francisco Fair Chance Ordinance.",San Francisco,http://www.indeed.com//rc/clk?jk=f69899a687b50b42&fccid=09abad886b83c501&vjs=3
151,Data Analyst,Pocket,"San Francisco, CA","We’re looking for a passionate, driven, and experienced data analyst to work with our world-class Data & Analytics team.
----------------------------------------------------------------------------------------------------------------------------------

At Pocket we love what we do, but more importantly we are building something that millions of people love, too. Pocket has become essential to how people discover and consume content worthy of their time and attention on any device and on their own time. If you are passionate about using technology to improve people's lives, we believe Pocket has challenges in front of us that will excite you.
------------------------------------------------------------------------------------------------------------------------------------------------------------------------------------------------------------------------------------------------------------------------------------------------------------------------------------------------------------------------------------------------------------

With millions of people discovering and consuming content across the Pocket platform, our community generates one of the most unique and interesting sets of data on the web. Furthermore, Pocket’s small size will allow you to work on diverse analysis instead of being limited to supporting any one business group. If you are interested in applying your data analysis skills to help each and every one of Pocket’s teams make timely, data-driven decisions, then Pocket might be the place for you!
-------------------------------------------------------------------------------------------------------------------------------------------------------------------------------------------------------------------------------------------------------------------------------------------------------------------------------------------------------------------------------------------------------------------------------------------------------------------------------------------------------------------------

We're a small team that has the resources of a large company (Pocket was acquired by Mozilla in 2017) and that means lots of opportunity to own projects from start to finish that have tremendous impact on hundreds of millions of users, across many different devices and platforms.
----------------------------------------------------------------------------------------------------------------------------------------------------------------------------------------------------------------------------------------------------------------------------------------

Come work with us and make a big impact.
----------------------------------------

------

What you’ll do:
---------------------


Conceptualize, build, and maintain dashboards and reports focusing on key metrics and experiments
Collaborate with product, business, and engineering teams across Pocket to support their data needs and refine their understanding of it
Explore and research data relating to key product and business metrics
Create simple and elegant data visualizations designed to communicate insights clearly

What you already have:
----------------------


BA/BS in a quantitative field
2+ years of experience in data analysis or statistics/math
Can demonstrate advanced SQL knowledge and are comfortable wrangling large data sets into easy to comprehend analysis and visualizations
Experience with a data visualization tool (e.g. Mode Analytics/Chartio/Tableau)
Enjoy communicating insights concisely, accurately, and meaningfully to a diverse audience
Have a passion for helping anyone and everyone understand complex topics
Any Python/R/Apache Spark experience considered a plus

About Pocket
------------

Learn more on our blog ( https://getpocket.com/blog/ ). To learn more about the Mozilla acquisition of Pocket, please visit our blog ( https://blog.mozilla.org/blog/2017/02/27/mozilla-acquires-pocket/ ).

Mozilla is committed to Equal Employment Opportunity throughout our recruiting and hiring process and is dedicated to growing diversity in our workplace.

We are an equal opportunity employer and value diversity at our company. We do not discriminate on the basis of race, religion, color, national origin, gender, sexual orientation, age, marital status, veteran status, or disability status.",San Francisco,http://www.indeed.com//rc/clk?jk=6f59dabf7de03b65&fccid=701c38c3ce450be3&vjs=3
152,Data Analyst,MasterClass,"San Francisco, CA","Who we are:
At MasterClass, our mission is to democratize online education by enabling enabling anyone in the world to learn from the very best. We are deconstructing what makes an actor able to cry on demand, how an athlete defies gravity, and what it takes to write a bestseller. Our online learning content is available to students anytime anywhere anytime, which supports our mission to democratize education.

We are a quickly growing VC-funded startup based in San Francisco and have created online classes taught by famous masters—Gordon Ramsay, Hans Zimmer, deadmau5, Werner Herzog, Shonda Rhimes, Serena Williams, Jane Goodall, James Patterson, Aaron Sorkin, Annie Leibovitz, Usher, Christina Aguilera and many more to come.

Since launching in 2015, we are growing our team. Apply now to find out more about what we are doing behind the scenes.

What we’re looking for:
As a Data Analyst at Masterclass you’ll be a part of our growing Analytics team, reporting directly to the Director of Analytics. You will collaborate directly with a variety of team members to collect, clean and analyze data which will drive our decision making and provide direction for future growth.

This analyst will serve as a cross-functional data expert whose analyses will help identify opportunities and explain trends. You’ll build close partnerships with across the various team leads and business units in order to help them optimize their resources and make decisions from the insights that you present.

Responsibilities of the role:

Partner with different departments (e.g. Engineering, Marketing, Content, Product, etc.) to produce insights
Build and maintain reporting/visualization and other tools to help deliver business insights and push the right data to the people who need it
Conduct exploratory data analysis and leverage data mining, visualization, and statistical modeling techniques to drive business decisions.
Continuously improve the quality and accessibility of our data reporting

Requirements:

3+ years of experience in a Data Insights, Data Analytics, Data Science or Business Analytics role
Strong experience in SQL (Redshift and PostgreSQL a plus)
Formidable R or Python skills
Experience with business intelligence tools (e.g. Looker, Tableau)
Expertise with statistical analyses and concepts (e.g. regressions, experiment design, etc.)
Strategically-minded yet detail-oriented
Excellent interpersonal communication and presentation skills
Consumer subscription business experience a major plus
BA/BS degree in a related field (Computer Science, Math, Statistics, Engineering)

At MasterClass, we believe we put our best work forward when our employees bring together ideas that are diverse in thought. We are proud to be an equal opportunity workplace and are committed to equal employment opportunity regardless of race, color, religion, national origin, age, sex, marital status, ancestry, physical or mental disability, genetic information, veteran status, gender identity or expression, sexual orientation, or any other characteristic protected by applicable federal, state or local law. In addition, MasterClass will provide reasonable accommodations for qualified individuals with disabilities. If you have a disability or special need, we would like to know how we can better accommodate you.",San Francisco,http://www.indeed.com//rc/clk?jk=904119c234ecfb2e&fccid=6139161347d735b5&vjs=3
153,"Data Analyst, Business Development",Uber,"San Francisco, CA 94103","About Uber

We’re changing the way people think about transportation. Not that long ago we were just an app to request premium black cars in a few metropolitan areas. Now we’re a part of the logistical fabric of more than 600 cities around the world. Whether it’s a ride, a sandwich, or a package, we use technology to give people what they want, when they want it.

For the people who drive with Uber, our app represents a flexible new way to earn money. For cities, we help strengthen local economies, improve access to transportation, and make streets safer.

And that’s just what we’re doing today. We’re thinking about the future, too. With teams working on autonomous trucking and self-driving cars, we’re in for the long haul. We’re reimagining how people and things move from one place to the next.
About the Role

The Business Development team is looking for a self-starter who wants to identify and solve highly analytical problems related to Uber’s Business Development and Partnership efforts.

You will work cross-functionally with the Data Science, Engineering, Product, and Finance teams to conduct analysis and build tools to support Uber’s strategic partnership activities.

Ideal candidates will have strong analytical and communication skills and an outstanding ability to translate data into actionable business strategies.
What You’ll Do
Provide deep insight and discover opportunities that drive our business.
Continually improve and automate our methods for parsing data and incorporating it into models, analyses, and actions.
Perform large-scale data analysis and develop effective statistical models for partner segmentation, classification, optimization, etc.
Effectively communicate data methodology and results to a diverse set of stakeholders. Translate numbers into actionable business strategy.

What You’ll Need
Bachelor’s and/or Master’s Degree in Economics, Math, Computer Science, Statistics, Management Science or other quantitative field.
At least 2 years of experience in a quantitative or analytical role
Strong SQL skills and experience utilizing common open source tools – such as Python and R – to work efficiently at scale.
Effective communication skills and ability to summarize and present large amounts of data.
Excellent multitasking skills to manage multiple projects across various teams and topics.
Willingness and desire to learn and adopt new skills – both technical and non-technical – in order to craft and deliver the best solutions.
Ability to collaborate with individuals from varying backgrounds and skill sets
A preference for quality over quantity- you get the math right and aspire to build the right solution.",San Francisco,http://www.indeed.com//rc/clk?jk=9cba8696e66171d4&fccid=f766f8bfbc3effb7&vjs=3
154,Business Systems Analyst - Intern,Leanplum,"San Francisco, CA 94103","About Leanplum

Leanplum is the ( http://www.leanplum.com )mobile marketing platform ( https://www.leanplum.com/ ) built for engagement. Brands rely on Leanplum to help them orchestrate multi-channel campaigns — from messaging to the in-app experience — all from a single, integrated platform. Global brands such as Tinder, Grab, Tesco, and Zynga turn to Leanplum to accelerate growth and build long-term customer relationships. Founded in 2012, Leanplum is based in San Francisco, with offices across North America, Europe, and Asia. Leanplum has received more than $93 million in funding from Norwest Venture Partners, Canaan Partners, Kleiner Perkins Caufield & Byers, and Shasta Ventures. Leanplum has been named to Business Insider's Most Valuable Enterprise Startups and SF Business Times’ Best Places to Work. Learn more at www.leanplum.com ( http://www.leanplum.com ).

Our Culture

Inside the walls of Leanplum (just kidding, our space is open), you’ll meet employees from 22 countries and counting. We house a world champion air guitarist, three medalists from programming competitions, and six loyal office dogs who greet you at the door with tails wagging. Past perks have included company vacations to Mexico and Tahoe, Alfred Hitchcock movie nights, and costume parties. But most of all, we believe in gratitude, collaboration, and karma.

Want the opportunity to work with some of the leaders in mobile? Want to learn about the industry trends and cutting-edge applications? We're looking for a Director of Business Applications to join our growing team in San Francisco!

About the Role

Leanplum is looking for a Business System Analyst Intern for our San Francisco Headquarter office. The Business System Analyst Intern will support key stakeholders and cross-functional team members to gather business requirements and drive system projects from initiation to deployment. This is a fantastic opportunity for someone who wants to learn various business applications, project management and software development lifecycle in areas related to Sales, Marketing, Finance, Customer Success, IT and Product. The successful candidate will be a self-starter who is willing to roll-up their sleeves, take coaching advice and effectively contribute in a team-oriented work environment.

About You


Academic background in Management Information Systems, Computer Science, Computer Engineering or similar major
Experience gathering business requirements and process documentation
Analytical inquisitiveness in gathering data to define functional and technical requirements
Strong quantitative and problem-solving skills with some conceptual understanding of different types of business applications that support Finance, IT, Sales, Marketing, Customer Success and/or Engineering
Some experience managing technical or system-related projects learned through previous internships, work experience or university-level projects
Ability to handle multiple projects simultaneously and take ownership in delivering project milestones
Strong written and verbal communication skills with professional demeanor
Self-reliant and team player
Ability to build relationships with key stakeholders and cross-functional team members
Detail and task oriented
Familiarity with project management methodology and software development lifecycle

Responsibilities


Partner up with Business Applications, IT and business stakeholders to gather functional and technical requirements
Analyze functional requirements and drive consensus among stakeholders
Create Business Requirement document (BRD) and assist in technical design
Gain proficiency of the company’s internal business systems to act as subject-matter support among different functional business stakeholders
Perform project management tasks for business application enhancement requests and software implementation
Perform system unit testing and assist in user-acceptance testing (UAT)
Identify areas of improvements and drive initiatives to promote operational efficiency

Benefits


Peer bonuses
Delicious and healthy lunches and dinners
Ping pong, darts, and foosball
Puppies galore

",San Francisco,http://www.indeed.com//rc/clk?jk=727ff835e82c9d5e&fccid=21de2b6ad81e2e15&vjs=3
