Id,title,company,location,description,search_city,link
102,Analytics & Insights Data Analyst,Uber,"San Francisco, CA 94103","About Uber

We’re changing the way people think about transportation. Not that long ago we were just an app to request premium black cars in a few metropolitan areas. Now we’re a part of the logistical fabric of more than 600 cities around the world. Whether it’s a ride, a sandwich, or a package, we use technology to give people what they want, when they want it.

For the people who drive with Uber, our app represents a flexible new way to earn money. For cities, we help strengthen local economies, improve access to transportation, and make streets safer.

And that’s just what we’re doing today. We’re thinking about the future, too. With teams working on autonomous trucking and self-driving cars, we’re in for the long haul. We’re reimagining how people and things move from one place to the next.
About the Role

As a member of the Analytics & Insights team, the Data Analyst will drive the analyses behind decisions related to our community's support experience and management of our various lines of business. For this role you should have excellent analytical skills, excellent time-management and organizational habits, and the ability to clearly communicate and present information for stakeholders at all levels of the business. The ideal candidate for this role should have strong analytical skills, excellent time-management and organizational habits, and the ability to clearly communicate and present information to stakeholders at all levels of the business.
What You’ll Do

Own data analysis and visualization, and communicate the outcomes/insights to various stakeholders to aid strategic decisions for improvements in support experience for drivers and riders
Coordinate with other members of the Community Operations Team to measure the impact and efficiency of new products and business processes
Develop analytical frameworks to support decision making in the US and Canada
Partner closely with specific Lines of Businesses to provide insights that drive decisions around process, policy and service model
Build, maintain, and communicate detailed reporting & models

What You’ll Need

Minimum 2 years of data science, business intelligence, investment banking, consulting or related experience
BA, BS, or MS degree in Economics, Business, Engineering, Operations Research, or other quantitative focus
SQL fluency
Experience in reporting-based software, such as Shiny
Exceptional Excel & data management skills
Strong communication and organization skills

Bonus Points If

High-growth analytics or operations experience
Experience working in a support environment (contact management analytics, Zendesk API familiarity, etc.)
Programming languages such as R and/or Python

About the Team

The NorthAm Community Operations team ensures that we are providing high-quality support at scale. The Analytics & Insights team is tasked with providing critical business insights to help identify opportunities and implement operational improvements across our entire organization.",San Francisco,http://www.indeed.com//rc/clk?jk=0ec5be3725bee4f9&fccid=f766f8bfbc3effb7&vjs=3
103,Junior Analyst,Eventbrite,"San Francisco, CA 94107","THE CHALLENGE
Eventbrite is in exciting times for the foreseeable future: We are expanding into new international markets, creating new products, and still growing our primary business. The Insights team within the Revenue Operations group plays an instrumental part in supporting all of these activities. You will be part of the team that drives scale and growth of our Ticketing & Registration Business Unit. You will drive better decision making by providing insights through weekly, monthly and quarterly analytics and reporting for our revenue teams. You will help us drive actionable insights.

THE TEAM
The Rev Ops team’s mission is to enable the Revenue teams to scale top line growth quickly and efficiently. As part of the Insights team, the Business Analyst will focus on supporting the the majority of the Revenue facing team with analytics while being part of an experienced, insight driven team. The Insights team is charged with providing analytical rigor to key strategic and operational questions, producing better decision making through data. The goal of the team is to help scale and drive insights that will impact top line growth of the Marketing, Sales and Customer organizations.
THE ROLE
The Business Analyst - The Candidate will join our Insights Team which is responsible for maintaining, updating and communicating most of the standardized analysis for Sales, Marketing and the Customer organization. The position will work closely within the Revenue Operations group and cross functionally with Marketing, Sales, and Customer Success. S/he will also be working with Finance, particularly FP&A and other Center of Excellence within Eventbrite.
YOU WILL
Analyze data, highlight trends to the revenue owners / leadership teams and prepare weekly, monthly and quarterly reporting.
Manage, maintain, and leverage dashboards in tools like Salesforce, Gainsight and Tableau to provide visibility into business performance.
Track progress of the business and its highest priority initiatives by identifying key metrics and building executive-facing dashboards in Tableau.
Discover and pursue new opportunities to grow and optimize the business through analytics, financial modeling, and business case development.
Identify key business levers, establish cause & effect, perform analyses, and communicate key findings to various stakeholders to empower data driven decision-making.
Complete in depth analyses to understand the root causes of business trends and pinpoint mitigation opportunities or specific actions to reduce risk and add value.
THE SKILL SET
2-5+ years of analytics experience.
Master of SQL, Excel and SFDC (reports, dashboards etc.)
Experience in FP&A, Finance, Consulting or business analytics role in high growth, global SaaS company.
Strong written and verbal communication skillsTeam player.
Bachelor’s degree (quantitative field preferred).
BONUS POINTS
Analytical experience in Sales Operations, Marketing Operations or Retention performance.
Experience with Python or R.
Experience with BI tools like Tableau.
Active Eventbrite user with passion for live events.
ABOUT EVENTBRITE
Eventbrite is the world’s largest ticketing and event technology platform, powering millions of live experiences around the globe. We build technology that allows anyone to create, share, find and attend events of all kinds. Music festivals, marathons, conferences, hackathons, political rallies, fundraisers, gaming competitions— you name it, we power it. Meet some of the team.

Eventbrite is a proud equal opportunity/affirmative action employer supporting workforce diversity. We do not discriminate based upon race, ethnicity, ancestry, citizenship status, religion, color, national origin, sex (including pregnancy, childbirth, or related medical conditions), marital status, registered domestic partner status, caregiver status, sexual orientation, gender, gender identity, gender expression, transgender status, sexual stereotypes, age, genetic information, military or veteran status, mental or physical disability, political affiliation, status as a victim of domestic violence, assault or stalking, or other applicable legally protected characteristics.

FLSA Status: Non Exempt

Pursuant to the San Francisco Fair Chance Ordinance, we will consider for employment qualified applicants with arrest and conviction records.

IS THIS ROLE NOT AN EXACT FIT?
Sign up to keep in touch and we’ll let you know when we have new positions on our team.

Applicant Privacy Notice",San Francisco,http://www.indeed.com//rc/clk?jk=ead35ddc10decbec&fccid=28dd3b780624bbf1&vjs=3
104,Marketing Data Analyst,Ubisoft,"San Francisco, CA 94107","Job Description

Ubisoft, a global leader in the video games and entertainment software industry, is seeking a highly talented, self-driven, detail-oriented, strategic and creative Marketing Data Analyst to support its Marketing and Web Analytics functions.
The analyst will be responsible for gathering, structuring and analyzing data to derive compelling insights that drive the optimization of our online marketing initiatives. This includes the design and management of tagging, tracking and web analytics solutions, to ascertain behavioral response to marketing initiatives and effect on engagement and conversion. The analyst will work closely with various stakeholders and among cross-functional teams, including Digital Marketing, Media, E-Commerce and CRM.

Responsibilities:
Work closely with marketing teams to define key metrics, identify trends and opportunities across channels, campaigns and consumer segments, and provide solutions for their analytic and KPI requestsResponsible for transforming raw data into actionable insights that ensure cross-departmental marketing efforts are effectively driving incremental engagement and conversionAnalyze websites data on traffic sources and patterns and conversion funnel; provide actionable insights to marketing teams on campaign analysis, customer segmentation and profiling; expand real-time analytics practice for high profile campaigns and new product / content launchesDevelop and implement tagging / web analytics code to enable tracking of online properties; ensure relevant traffic and key performance metrics are captured in order to provide actionable insights; document all data standards and processes as appropriate and audit when necessaryCoordinate efforts to define campaigns tracking governance across online channels; maintain page tagging standards and build business processes to streamline tag deployment across web propertiesWork with marketing teams to develop A/B and multivariate testing strategies to understand the online customer experience; develop and implement processes and procedures to regularly test, measure and improve online creative contentCreate, manage and distribute data and insights via regular and ad-hoc reporting utilizing analytics tools (Google Analytics, Adobe Social, Adobe Catalyst,…) and reporting/analysis platforms (Microstrategy, Tableau, SQL, Excel, …) Qualifications

Ubisoft seeks high-performing individuals with analytical minds and strong interpersonal and communication skills. Ideal candidates are self-starters who can manage their time effectively and educate themselves while contributing to marketing investments performance.

Bachelor degree in a technical or quantitative discipline (Mathematics, Economics, Statistics, Computer Science, Engineering), Master’s preferred3-5 years business analysis experience with more than two years hands-on experience with web analytics requiredExperience working with an enterprise web analytics platform (e.g., Adobe/Omniture, Webtrends, etc.) requiredExperience in web analytics requirements gathering, solution design and implementation; solid experience in the area of online visitor intelligence / behavior, tracking/taggingTag Management solutions knowledge a plusAd Serving platforms (Double Click, Ad Tech, Atlas, …) knowledge a plusStrong quantitative skills, and experience utilizing scientific analytic methods, qualitative methods, and quantitative analysis techniquesExcellent organizational, communication and interpersonal skillsIn depth knowledge of SQL and Excel; programming experience and knowledge of Tableau a plus

Additional Information


Ubisoft is committed to creating an inclusive work environment that reflects the diversity of our player community. We are an equal opportunity employer. Qualified applicants will receive consideration for employment without regard to their race, ethnicity, religion, gender, sexual orientation, age or disability status.",San Francisco,http://www.indeed.com//rc/clk?jk=0d61eb96c05fb65f&fccid=237908de095b6446&vjs=3
105,Business Analyst,Sony Interactive Entertainment PlayStation,"San Mateo, CA","Recognized as a global leader in interactive and digital entertainment, Sony Interactive Entertainment (SIE) is responsible for the PlayStation® brand and family of products and services. PlayStation has delivered innovation to the market since the launch of the original PlayStation in Japan in 1994. The PlayStation family of products and services include PlayStation®4, PlayStation®VR, PlayStation®Vita, PlayStation®3, PlayStation®Store, PlayStation®Plus, PlayStation™Video, PlayStation™Music, PlayStation™Now, PlayStation™Vue, PlayStation®Original and acclaimed PlayStation software titles from SIE Worldwide Studios. Headquartered in San Mateo, California, SIE is a wholly-owned subsidiary of Sony Corporation and has global functions and regional headquarters in California, London and Tokyo.

Business Analyst

San Mateo, CA

Description:
Sony Interactive Entertainment LLC (SIE), a subsidiary of Sony Corporation of America, is the premier provider of digital entertainment. Through the Sony Entertainment Network portal, consumers around the world are able to access their favorite digital entertainment conveniently and instantly on their favorite connected devices. SIE offers the latest and highest quality music, video, and game content through Sony Entertainment Network as well as PlayStation Network while also delivering third-party services. In addition, SIE provides a compelling consumer experience through innovative content discovery features and a simple user interface that is globally consistent, yet locally relevant.


Extract and integrate data from multiple databases/system sources via SQL and reporting tools to support status reporting and analytical efforts related to ecommerce management, services, execution, planning and tracking. Develop and manipulate spreadsheets, databases, and data and web analytical tools
Cross service analysis that focuses on video, music and gaming divisions.
An understanding of a la carte and subscription based business models.
Defining the annual budget across services including revenue and cost projections, operating profit and P&L view development
Tracking and reporting multiple financial KPIs to leadership on a monthly basis including revenue, studio and label revenue share payments, development and marketing costs, marketing ROI analysis, etc.
Financial modeling of various business structure, M&A options for various services within the business
Financial modeling and business case development for new growth ventures across services.
Assist Business Strategy and Analytics team in developing insightful and actionable analysis of Sony’ Network Services and Product Offerings
Develop data analysis and status reports as required to meet management requirements
Provide thought-leadership in on-going financial measurement and analysis of SIE’s services. Identify new ideas and opportunities for analytic projects
Analyze data from online marketing campaigns: user response, web site conversions, feature usage, attrition rates. Support online customer analyses, such as: Customer Segmentation, Retention Analysis, Lifetime Value Analysis, Marketing ROI, Brand Research, Site Utilization
Provide detailed monthly and quarterly financial overviews to management. Participate and support in delivering results and presentations to clients

Qualifications:

Minimum 1-2 years of experience in a business intelligence role, marketing analysis, business and/or financial management tasks for commercial organizations, preferably within the ecommerce space
Master's Degree in Advanced Mathematics, Statistics or Engineering preferred, BA/BS Degree (Mathematics, Statistics or Computer Science) is a minimum requirement.
A BA/BS Degree is required
SQL programming skills required
R Visualization experience
SPSS Modeler/SAS (Enterprise Guide)/SAS (Enterprise Miner) or similar experience
Business Model development and Forecasting abilities
Experience with standard BI Tools (Tableau, MicroStrategy, Business Objects, , Cognos, etc.) and web tools including Omniture, DFA, Webtrends, Visual Science, Coremetrics, WebSideStory, etc
Expert user of Microsoft Office (Work, Excel, Access, Project, and PowerPoint) as well as Visio in order to prepare all documents, presentations, tables, briefings, and worksheets Strong written & verbal communication skills
You are familiar with the PlayStation Network

Sony is an Equal Opportunity Employer. All persons will receive consideration for employment without regard to race, color, religion, gender, pregnancy, national origin, ancestry, citizenship, age, legally protected physical or mental disability, covered veteran status, status in the U.S. uniformed services, sexual orientation, gender identity, marital status, genetic information or membership in any other legally protected category.

We strive to create an inclusive environment, empower employees and embrace diversity. We encourage everyone to respond.

We sincerely appreciate the time and effort you spent in contacting us and we thank you for your interest in PlayStation.

#LI-GD1",San Francisco,http://www.indeed.com//rc/clk?jk=8d88aa173c36343f&fccid=dc156e4b91443100&vjs=3
106,"Data Engineer, Analytics",Pinterest,"San Francisco, CA 94103","As a Data Engineer on the Data Analytics team you'll provide necessary intelligence to the rest of the company that will enable making better product decisions. You'll make use of the latest advances in large scale data processing, machine learning, and data visualization to uncover insights in data. You’ll be part of the data engineering team, working on some of the most interesting datasets with a world-class team of engineers towards the mission of enabling data-driven products and insights at Pinterest.

What you’ll do:

Build scalable OLAP backend storage for data in PB scale.
Build robust data pipelines that collect, process, and compute business metrics from activity data using Spark
Work with business analysts and data engineers to build new analysis tools and metrics for measuring product engagement

What we're looking for:

Minimum 3 years of industry experience
Degree in computer science, machine learning, or statistics
Extensive programming experience in Python/Scala/Java
Extensive experience with one or more of the follow frameworks. (Spark, Druid, Hadoop, HBase, Kafka)

#LI-VW1",San Francisco,http://www.indeed.com//rc/clk?jk=163e4ef814b6f9fb&fccid=43014b1412e0a7b6&vjs=3
107,Data Analyst - Content Team,Twitch,"San Francisco, CA","Data is central to Twitch’s decision-making process, and analysts are a critical component to evangelize data-driven decision making in all of our operations. As a Data Analyst at Twitch, you will be in on the ground floor with the content team, shaping the way business performance is measured, defining what questions should be asked, and scaling analytics methods and tools to support our growing business, leading the way for high-quality, high-velocity decisions for your team.

For this role, we’re looking for an experienced data analyst who will help develop the strategy for our content team by helping us define and track KPIs, support strategic initiatives, and evaluate new lines of business.

You’ll help create self-service reporting tools to support the entire team. We’re seeking an individual who has the vision and strategic thinking skills to make analytics best in class at Twitch.
Responsibilities
Operationalize data processes - provide the team with ad-hoc analysis, automated dashboards, and self-service reporting tools so that everyone gets a good sense of the state of the business.
Establish analytical framework for your team: partner across stakeholders to define measurement approach, quantify and evaluate success, and develop KPIs and guide tracking efforts for ongoing measurement and reporting.
Tackle complex and ambiguous analytic projects: resolve ambiguity as much as possible in all stages, comfortably flex among various tools to answer complicated questions, and accurately identify the trade-offs between speed and quality and apply or route work as necessary.
Efficiently prioritize and execute what’s important: prioritize for both speed and impact, and aggressively optimize for return by focusing on work output that scales well and is reusable.
Maintain a culture of high quality output and exceptional customer service: effectively communicate at all levels, ensure that work gets done well and on time, respond effectively to unexpected obstacles and reallocate resources as necessary.
Serve as a key member of the Content team focused on helping to evaluate strategic opportunities; evaluate new adjacent businesses and categories that the content team can explore.
Requirements
2+ years of experience using data analysis to drive business decisions
Exceptional SQL skills. Your ability to tap into our data pipeline will be the key to your success
The right person will be technical and analytical, with a clear ability to think strategically, in addition to extensive data experience.
Strong verbal and written communications skills are a must.
Data visualization and presentation skills are a must.
Demonstrated ability to work effectively across internal organizations is key.

Perks
Full benefits, including medical, dental, vision and life
401(k) savings plan with a company match
Catered daily lunch and dinners (and hearty breakfasts three times a week)
Unlimited snacks and drinks
Monthly in-office massages
Corporate gym membership
Commuter benefits
Flexible time off policy
Weekly happy hours and opportunity to attend one gaming event or tournament
Top of the line technology to help you build your own workspace
Twitch is the world’s leading video platform and community for gamers, with more than 100 million visitors per month. We connect gamers from around the world by allowing them to broadcast, watch, and chat with each other. Twitch’s live and on-demand video platform forms the backbone of a distribution network for video game broadcasters including pro players, tournaments, leagues, developers and gaming media organizations. Twitch is leading a revolution in gaming culture, turning gameplay into an immersive video experience. Learn more at: http://twitch.tv

We are an equal opportunity employer and value diversity at Twitch. We do not discriminate on the basis of race, religion, color, national origin, gender, sexual orientation, age, marital status, veteran status, or disability status. Pursuant to the San Francisco Fair Chance Ordinance, we will consider for employment qualified applicants with arrest and conviction records.",San Francisco,http://www.indeed.com//rc/clk?jk=3cf424c398b7e0f0&fccid=e21f6affbb4bb0b2&vjs=3
