Id,title,company,location,description,search_city,link
52,Data Scientist,"AbleTo, Inc.","New York, NY","Overview
AbleTo, Inc. is a market leader in providing technology-enabled behavioral health care. AbleTo has been treating patients for over six years, and improves patient outcomes and lowers costs by providing treatment that integrates behavioral and medical health care. AbleTo's structured therapy programs strengthen medical recovery and self-care among members with chronic or complex clinical needs. AbleTo analytics, coupled with our multi-channel engagement platform, identify and engage members with unmet, often undiagnosed, behavioral health needs. A proprietary platform connects individuals and their care teams with AbleTo licensed providers who deliver weekly sessions by phone or video supported by an integrated digital experience. AbleTo programs are clinically proven to improve both behavioral health and medical outcomes while lowering overall spending for higher-cost, higher-risk members. AbleTo's investors include .406 Ventures, Sandbox Industries, HLM Venture Partners, Horizon Healthcare Services, Inc., Bain Capital Ventures, and Aetna Ventures.
Responsibilities
AbleTo, Inc. uses a network of therapists to deliver structured behavioral health therapy to high-risk patients in health plans. Program participants experience improved health, and faster recovery. Your role will be pivotal in driving success in a company recognizing the importance and value of making data-driven decisions.

Data & Analytics Team

The Data & Analytics team plays a key role at AbleTo.

You will report directly to our VP of Data and Analytics.
With our Research team, you will build claims-based predictive models
With our Engagement team, you will help optimize patient outreach
With our Clinical team, you will ensure operational efficiency
With our Product team you will help design and implement data-driven features

Members of the Data & Analytics team are:

Highly collaborative & greatly appreciated across the company
Focused on the success of the team and company
Both technically and strategically savvy, able to sift through large amounts of data
Focused on building well-designed solutions and preserving quality control
Willing to experiment with new tools / techniques
Qualifications
Technical Skills

High proficiency in Python (sklearn, pandas, numpy)
Machine learning experience such as SparkML and sklearn
Highly skilled in SQL
Some exposure to natural language processing
Experience with the Google Cloud Platform a plus

Education / Experience

2+ years of experience in data science, preferably with a focus in health care
Ph.D. from a highly quantitative discipline (e.g. statistics, biostatistics, public health, economics / econometrics, etc.)
Direct hands on experience work with large scale datasets - this is a hands on day to day immersion in big data, creating new predictive models, etc
Strong communication skills
Medicare / Medicare Advantage experience a plus

Experience collaborating on code with other developers

Some exposure to Agile Development, or Lean or Six Sigma would be valuable

AbleTo is an equal opportunity employer. All qualified applicants will receive consideration for employment without regard to race, color, religion, sex, sexual orientation, gender identity, national origin, disability or veteran status. AbleTo is an E-Verify company.",New York,http://www.indeed.com//rc/clk?jk=325387773833e856&fccid=954e57501f6bca1f&vjs=3
53,Data Analyst,Schireson,"New York, NY","Who We’re Looking For

We are looking for a data analyst with Python and SQL experience to join our growing team and assist our data scientists in the creation of cutting edge analyses and data oriented products.

The ideal candidate will have:

A BS/BA degree from a well-regarded college or university
Proficiency in Python and SQL
Proficiency in Microsoft Office (Excel, Word, PowerPoint)
Experience working with AWS architecture
A desire to work on products that leverage big data, predictive modeling, and machine learning (but not alone!)
A willingness to learn foundational knowledge and skills rapidly
Superb communication and presentation skills
Ability to think strategically, analytically, and proactively about diverse business problems
Passion for managing the quality & accuracy of analytics, including checking your and others’ work
A MS degree in a quantitative or programming related field (Computer Science, Statistics, Applied Mathematics, Data Science, etc.) is a plus
1-3 years experience in media, consulting, or analytics is a plus
Experience multi-tasking in a fast-paced – and a fast-growing – small company or professional services/consulting firm environment is a plus
Experience in advertising or media & entertainment are a plus
Experience with predictive analytics / data science is a plus

Your responsibilities would include:

Creating and validating ad hoc data analyses
Building presentations for client reports
Operating existing software infrastructure to build, evaluate, and put into production key client deliverables
Interfacing directly with clients to assist with overall operations
Running existing in house data simulators to produce key client deliverables
Exploring and reporting on data interactions from new data sets
Assisting clients with data strategy questions

About Schireson

Schireson is a strategic data science consulting firm with offices in New York, Boston, Seattle, Austin, and San Francisco. We always aim to do superb work, and we always try to make the experience of working with us delightful. We also try to have fun while we’re doing it.

Our clients are market leaders from a wide range of industries, including media & entertainment, technology, professional services, non-profit, financial services, and automotive among other categories. We forge deep, on-going relationships with our clients, and in return they trust us to help them navigate their most complex business challenges.

Our academic backgrounds are varied – from PhDs to BAs, from Ivy League schools to state schools. Many of us have professional roots in tech and marketing, and our collective previous experience spans music, entrepreneurship, market research, venture capital, investment banking and management consulting.

About Schireson’s Media Practice

We’re looking for data analysts to work in our growing media practice, which includes data science, data engineering, and software engineering disciplines. Schireson is a market leader in the creation of advanced advertising products, used to connect media advertising to the ideal consumers. We work across several media formats, with a majority of our work focused on TV advertising. We use data to help TV publishers increase the impact of their advertising offerings.",New York,http://www.indeed.com//rc/clk?jk=fa55667ce4dc513e&fccid=8b59d1d4e9878785&vjs=3
54,Data Analyst,WayBetter,"New York, NY","We’re looking for a data analyst who can see beyond the numbers - someone who’s insights will show us how we can better help our customers achieve their goals. Working alongside the Director of Analytics, this position will provide support across the board, to ensure accurate and timely reporting is provided to our stakeholders.

This role will work across entire the WayBetter team, offering great visibility within the company, and providing a significant opportunity to develop and refine a variety of skills, whilst working on a range of projects. This is an opportunity to join a unique and growing company, at a key period in the growth cycle.

Responsibilities

Maintain and verify the accuracy of reports for existing Waybetter products.
Respond to data requests from stakeholders and provide insights / recommendations into the analysis provided.
Work closely with the engineering team to ensure events are passed through different reporting platforms properly.
QA reports and events to ensure above requirement.
Propose new reporting were appropriate.
Help the company in streamlining reporting across products.
Update and create new documentation for reporting and processes.

Required qualifications

Bachelor’s degree or equivalent work experience
Minimum 2 years of experience
Proficient in SQL.
An understanding of how web and mobile applications work and are built
Ability to analyze and interpret marketing data
Excellent written and verbal communication skills
Interest in learning
Experience prioritizing workload, working independently and managing work to defined schedules
Consistent, dependable performer with an excellent work ethic, flexible ""can-do"" attitude, and a results-driven commitment to success
Solid analytical thinking and problem-solving skills
Detail oriented and committed to a high level of accuracy
Some experience working in a tech start-up preferred

Compensation and benefits

Generous health care coverage
401(K)
Untracked, flexible vacation policy
Training opportunities
Meaningful equity participation
A healthy, collaborative, fun work environment

About us

WayBetter is reinventing motivation itself. We make a whole new category of games that help people stick to their commitments — from eating better to exercising more to learning to cook, play the guitar, or speak Spanish. Our games use an innovative mix of manageable goals, social support, and financial incentives. DietBet launched in 2013, StepBet in 2016, RunBet in 2017, and SweatBet is coming in early 2018.

Our approach is based on behavioral science and it works. To date we’ve had 700,000 paying players who have collectively lost 9 million pounds and walked 350 million miles. And we’ve paid out over $50 million to our winners.

In our games and in our work we believe that fun is the secret to sustainable success. As such we care a lot about our culture and practice what we preach by making it enjoyable, social, and rewarding.

WayBetter is the rare company with a double bottom line: we succeed when our customers do. Our mission as a company is to improve people’s lives in very real ways.

Want to apply? Please send your resume, portfolio, and a note that tells us something about you that we can't pick up from your portfolio and resume.",New York,http://www.indeed.com//rc/clk?jk=4bc71b30b93ac981&fccid=747c9694bc549347&vjs=3
55,Data Analyst,Komodo Health,"New York, NY","Komodo Health is addressing the global burden of disease through the world’s most actionable healthcare map. Our solutions drive a more transparent, efficient and productive healthcare ecosystem. We value our culture of encouraging growth, collaboration, and constructive debate as well as delivering innovative solutions that “wow” our customers.

We are looking for a Data Analyst to translate our proprietary data stack comprised of hundreds of millions of patient lives and billions of clinical transactions into meaningful insights for our customers. This role would work very closely with the Customer Success team at Komodo to scope, run and iterate on analyses requested by our client base.

This is an opportunity to join a high caliber Data Science and Engineering team, with pedigrees from top universities and companies. You will be asked to solve real-world problems in the Healthcare and Life Science space. Komodo is a fast-growing startup with very ambitious growth goals that has partnered with multiple Fortune 500 companies, This is a new role at Komodo, so there is a lot of room to help shape and define how to make it most effective. This is a role for someone who wants to use one of the biggest, most complete healthcare datasets to solve real world problems that deliver value to our clients while being part of the collaborative, fun, nurturing Komodo community!

RESPONSIBILITIES


Perform data analysis on an industry leading healthcare data stack, helping to understand trends and develop insights for our clients.
Drive all aspects of the analysis life cycle, from working with business stakeholders to determine the best way to solve the business need using data through the delivery of high quality error-free outputs to the appropriate stakeholders
Gain software development insights by moving projects from rapid prototypes to more scalable code that can be run repeatedly
Clearly communicate analysis methods and results to Komodo and client team
Support pre-sales and post-sales analytics needs
Collaborate closely with the rest of the Data Science team to ensure that key analyses are documented and communicated to the product team

REQUIREMENTS
------------


BS or MS, in Computer Science, Engineering or related field
Experience with…
Python, Scala, or Java
Analytical packages (e.g. R, MatLab, Pandas, SciPy)
SQL and Relational Databases
Possess a strong blend of technology and analytical skill
Demonstrable successes in conducting analyses to generate business insights
Solution/Delivery-oriented team player willing to go above and beyond
High motivation, work ethic, and self-discipline to organize and complete tasks
Sincere interest in working at a startup and scaling with the company as we grow

Nice to Have


Experience or interest in the life sciences industry
Track record of delivering analytical solutions to poorly scoped problems
Prior client-side analytical experience serving Marketing, Sales, Medical Affairs, or Clinical Development, or, vendor-side analytical experience working with Life Sciences clients
Experience working with proprietary secondary data including medical / pharmacy claims, prescription data, sales data, and longitudinal patient-level data

BENEFITS
--------


Competitive salary and equity compensation
Full Medical, Dental, and Vision benefits
401k plan with employer match
Your choice of equipment set-up (computer, monitor, and accessories)
Flexible hours and unlimited vacation days policy
Opportunities to attend industry conferences and events
Awesome team and culture
Great office location(s) in SF/SOMA and NY/Astor Place

",New York,http://www.indeed.com//rc/clk?jk=580f419a220d3c74&fccid=086cb533b5438773&vjs=3
56,Data Analyst,SmartAsset,"New York, NY","Job Description
SmartAsset is looking for a junior Data Analyst to join our NYC-based Data Engineering team. As Data Analyst, you will work on a wide range of challenging tasks together with our Product, Business and Data Engineering teams.

Requirements:

Excellent Mathematics and Statistics Skills
Knowledge of Excel (including Visual Basic scripting)
Some knowledge of software development (with one of the following languages: Python, Java, Ruby, JavaScript, Perl, C/C++)
Experience with Linux/Unix environments and shell scripting
Experience with some statistics tools (SPSS, R, etc)
Excellent communication skills required

Responsibilities:

Work with our in-house Data Engineering and Analytics team
Provide reports and analysis to various internal teams
Build automated reporting systems as required
Analyze various data-sets and provide insights

Benefits:

Highly competitive compensation (salary and equity)
Medical & dental insurance

About Us:
SmartAsset is a venture backed, Y Combinator Company. We use our financial modeling technology to provide accurate, interactive answers to important personal finance questions. We are a consumer advocate, recommending specific strategies so people can make smarter decisions and save money. We have been covered by over 50 publications, including the New York Times, Techcrunch, Fast Company and the US News and World Report.",New York,http://www.indeed.com//rc/clk?jk=265ad664a12c7b81&fccid=94eb61eaf1bf49bc&vjs=3
57,Statistical Analyst,Mount Sinai,"New York, NY","Strength Through Diversity

Ground breaking science. Advancing medicine. Healing made personal.

Mount Sinai Health System
HSO Clinical Data Registries- 2260578

The mission of the Office of Quality Operations is to improve health system performance and outcomes by providing leadership and care teams with the data and insights they need for operations, clinical performance measurement, quality improvement, analytics and outcomes research. We provide solutions to integrate, cleanse, govern, translate and dispense information across Mount Sinai’s clinical institutes and clinical care service lines. Our team is seeking a Statistical Analyst to lead outcomes research effort, define clinical measurements and use clinical data to improve quality.

Roles & Responsibilities:
Sourcing and preparing data from various data sources.
Working with and explaining missing and messy data values.
Translating department/personal requirements for data answers with minimal guidance.
Leading an analytics/statistics project from start to finish
Visualizing answers clearly and concisely while considering all complexities that are inherent in health care data.
Documenting workflow and tools
Work with clinical teams/internal leads to define measures for assessment.
Work with senior analysts to define analysis techniques for answering these questions.
Create interactive Tableau dashboards for various hospital staff
Use common collaboration tools (git, Markdown) along with scripting languages (R, SQL) to create reproducible analyses.
Contribute to internal R packages.
Identify improvements to workflow and analysis processes used by the internal team and help implement them
Define statistically and clinically relevant survey questions.
Requirements:
Master’s degree or Ph.D. in Statistics, Mathematics, Economics or Public Health.
Possesses advanced statistics skills including an understanding of probability and its application to the analysis of data including statistical process control, process monitoring, and diagnostics.
Excellent at communicating difficult statistical concepts (Oral and Written)
Self-motivated and organized in pushing projects to completion.
Able to learn quickly on the job, with minimal guidance.
Two (+) years of experience in R
Preferred Experience:
Experience with performance improvement methodologies (Lean, Six Sigma) and data-driven improvement efforts
Experience in designing surveys for patient reported outcomes.
Strong understanding of data warehousing/organization principles.
General understanding of healthcare departmental/clinical operations, workflow, policies, and procedures
Strength Through Diversity
The Mount Sinai Health System believes that diversity is a driver for excellence. We share a common devotion to delivering exceptional patient care. Yet we’re as diverse as the city we call home- culturally, ethically, in outlook and lifestyle. When you join us, you become a
part of Mount Sinai’s unrivaled record of achievement, education and advancement as we revolutionize medicine together.

We work hard to acquire and retain the best people, and to create a welcoming, nurturing work environment where you can develop professionally. We share the belief that all employees, regardless of job title or expertise, can make an impact on quality patient care.
Explore more about this opportunity and how you can help us write a new chapter in our story!

Who We Are

Over 38,000 employees strong, the mission of the Mount Sinai Health System is to provide compassionate patient care with seamless coordination and to advance medicine through unrivaled education, research, and outreach in the many diverse communities we serve.

Formed in September 2013, The Mount Sinai Health System combines the excellence of the Icahn School of Medicine at Mount Sinai with seven premier hospital campuses, including Mount Sinai Beth Israel, Mount Sinai Beth Israel Brooklyn, The Mount Sinai Hospital, Mount Sinai Queens, Mount Sinai West (formerly Mount Sinai Roosevelt), Mount Sinai St. Luke’s, and New York Eye and Ear Infirmary of Mount Sinai.

The Mount Sinai Health System is an equal opportunity employer. We promote recognition and respect for individual and cultural differences, and we work to make our employees feel valued and appreciated, whatever their race, gender, background, or",New York,http://www.indeed.com//rc/clk?jk=34af21981ed19aac&fccid=c007936ceb766fe5&vjs=3
58,Analyst,HRG North America,"New York, NY 10017","HRG Consulting is at the forefront of providing an extensive range of professional services in the corporate travel and procurement field including strategic advice in preferred supplier program management (e.g. Airline, Hotel and Car Rental Company), outsourcing, benchmarking and travel policy review.Our extensive experience, knowledge and state of the art systems are used to provide our clients expert, high-quality support on a fee-based project basis.HRG Consulting is an independent division of HRG Travel which is one of the world’s largest corporate travel and expense management companies. For more background information on HRG please visit www.hrgworldwide.com/consulting.OVERALL OBJECTIVES: To support the management team in the success and development of HRG ConsultingTo deliver profitable, project-based consulting services to customers in all areas of travel supplier management and procurementTo manage the delivery of analysis and development supportTo provide information and advice to HRG Sales and Business ManagementTo enable the delivery of profitable and efficient analysis tools, products and processesTo develop and maintain an effective and professional relationship with suppliersKEY AREAS OF ACTIVITY / KEY TASKS: Analysis and interpretation of airline, hotel, car rental and other travel data using Excel, Access, Alteryx, Tableau and other toolsModeling of airline, hotel, car rental and other supplier corporate discount programs to help our clients understand the value achieved and options for negotiation or alternative sourcingLiaising with airlines, hotels and car rental companies in the collection of data and pricingPreparing client reports, models and analysisWorking closely with the team members to deliver accurate information and analysis to clientsCarrying out travel industry research and producing papers or presentations as required for client projects or to support wider HRG initiativesPlaying an active role in generating ideas for new models and analysis which could be developed to enhance our client proposition or to help develop the financial success of the companyQUALIFICATIONS AND EXPERIENCE REQUIRED: Knowledge and Skills: College degree – Mathematics, Scientific, Operations Research or Computer Science study an advantageExcellent interpersonal skills with the confidence and ability to communicate effectively and professionally at all levels of organizational structure, both internally and externallyStrong analytical skills with ability to interpret data from a variety of sources to identify areas of opportunities and recommended solutionsTime management and self management skills and demonstrable consistency in meeting agreed deadlines / time-frames in a pressurized environmentExpert level understanding of Excel, Access, with usage of VBA, web development and technology solutionsProven ability to work on own initiative without the need for significant supervisionProven analytical problem-solving abilityProven ability to work as an active and participating member of a teamStrong attention to detail, analytical mind and conscientious approachFluency in spoken and written English is essentialJob Type: Full-time",New York,http://www.indeed.com//company/HRG-Worldwide/jobs/Analyst-febed5e77b3eeeb8?fccid=bbc5cb2b8ed58c9c&vjs=3
